{"$comment":"Rejilla del mapa en punto de cruz: W×H celdas de S px. rows usa run-length: \"v*n\" (v en base36 = índice en places.json, \".\" = mar). palette = familias de color por estado.","W":155,"H":104,"S":6,"lab":{"yuc":[462,20],"qroo":[863,374],"camp":[139,250],"hid":null},"rows":[".*155",".*155",".*155",".*106,12*2,.*47",".*104,11*2,12*7,.*18,30,36,.*22",".*98,11*7,12*5,2r*6,.*11,30*3,.*2,36*3,.*20",".*94,1g*4,11,1g,11*6,12*2,2r*12,.*12,36*4,.*19",".*93,1g*5,17,11*6,12,17,12,2r*14,30*2,.*7,30,36*4,.*19",".*91,1g*4,2,1g,17*6,11*2,17*3,2r*14,30*10,36*5,.*18",".*87,1g*5,2*6,17*9,2r*15,30*10,36*5,.*2,36,.*15",".*80,0*2,f*2,1c*3,1g*2,2,1g,2,1g*2,2*4,17*9,2r*15,30*10,36*6,.*17",".*72,15,1u*2,23,1b*2,2h*2,0*2,f*2,1c*2,2*9,19*3,17*8,2r*16,30*10,36*6,.*17",".*67,15*6,1u*2,23,1b*3,2g,0,f*3,1c*2,2*3,1r*2,19*7,17,28*3,17*3,2r*17,30*10,36*6,.*17",".*64,i,15*8,1u*2,23,1b*3,2g,0*2,f*2,1c*2,2,1r,2,1r,19*9,28*3,17*2,2r*18,30*10,36*7,.*16",".*62,i*2,15,2x,15*7,1u,22,5,23,1b*2,2g,23*2,d*4,1r*4,19*8,28*5,2r*19,30*10,31*7,.*16",".*59,i*6,2x,10*3,15,10*2,1v,1u*2,5*2,23*4,29,23,d*2,1r*6,19*4,s*3,2b,28*5,2r*18,30*10,31*8,.*15",".*57,i*9,2x,10*5,t,22*2,5*2,23*3,29*3,d,2l,2j*2,1r,1d*2,1r*2,19*2,s*4,2b*7,2r*17,30*10,31*9,.*14",".*56,n,i*9,2x,10*5,t*3,2w,25*2,23*3,29*2,2l*2,2j,1r*2,1d*4,1r,s*5,2b*6,2r*2,o,2r*15,30*5,37*6,31*7,.*15",".*54,n*3,i*9,2x*2,10*6,2w,14*2,25*2,23*2,6,2e,2l,2j*2,2d*2,1d*2,2d*3,s*6,2b*5,o*6,2r*12,30*5,37*6,31*7,.*15",".*53,n*2,i*3,2k,i,2k*3,i*3,2x*2,10*5,2t*2,14*3,b*3,6,2e*2,2l*2,2d,2n*2,2d*3,2u,s*5,2b*6,o*6,2o,2r,2o,2r*9,30*5,37*6,31*6,.*16",".*52,n*3,i,2k*8,i*2,q,10*5,2t*2,10,14*3,b*3,6,2n*8,2u*4,s*5,2b*6,2o*2,o*2,2o*5,1h,2r,1h*4,2r,30*6,37*6,31*6,.*16",".*52,n*4,2k*6,1x,27,i*2,q*2,10*3,h*3,2t,w*2,14,2c*2,1k,2n*8,2u*5,s*3,j*2,2b*5,2o*10,1h*6,30*7,37*11,.*17",".*52,n*4,1x*4,2k,1x*2,27*3,q*3,10*2,h*3,1f*2,w,2c*3,1k*3,2n,u*4,2n*2,2u*4,26,j*5,2s*2,2b*2,2o*9,1h*7,30*7,37*11,.*17",".*51,n*5,1x*5,27*3,q*5,10*3,2m,1f*2,w*3,2c,1j,1k,2v,1k,2v,1k,2n,u*2,2n*2,2u*4,26*2,j*2,2q*2,2s*2,p,2o*7,p,2o,1h*7,30*11,37*8,.*17",".*51,3l,n*6,1x*4,27*2,z,q*4,10*3,2m*2,1f*2,w,1j*4,2v*3,1n*2,2n,1n,u,2u,u,2u*3,26,j*3,2q*2,2s,2q,2s,p,2o*4,p*3,1h*8,30*11,37*2,38*5,.*18",".*51,3l,n*4,21*2,1x*3,27*3,z*2,q,z,q,10*3,2m,1p,1f,w*2,x,w,1m,8,1j,1t,2v,1n*2,2n,1n,u*4,2u,26,2q,j*2,2q*5,p*8,1h*8,30*12,38*6,.*19",".*51,3l,1e,21*8,z*7,q,10*3,1p*4,x*2,1m*2,1t*4,1n*3,v,u*2,2p*4,2q*7,2s*2,p*6,1h*9,30*11,38*7,.*19",".*50,3l*2,1e*2,21*9,1y,z*3,3*5,2m,1p*3,x*2,1m*3,1t*3,v,1n,v*3,u,2p*4,2q*5,2s*4,p*7,1h*7,30*12,38*5,.*21",".*50,3l*2,1e*4,21*5,1y*5,z,3*5,2m,1p*4,1m*4,1t*3,v*6,2p*4,2q*6,2i*3,p*7,1h*6,38*2,30*4,38*12,.*21",".*49,3l*3,1e*5,21*5,1y*4,a,3*6,1p*4,1m,2f*3,1m,1t,v*7,2p*4,m*4,1w*4,2i,7,k*2,p*4,1h*5,38*5,30*2,38*11,.*22",".*50,3l*2,1e*7,21*3,a*5,24,1l*2,3,1l,1p*4,2f*6,v*7,2p*6,m*4,1w,2i,7*3,k*2,p*5,1h*3,38*16,34*2,.*23",".*49,3l*7,1e*4,21*3,a*4,24,1l,24,1l*2,l*3,1z,2f*5,c*2,v*5,2p*7,m*3,1w,m,2i,7,13*2,k*2,p*5,1h*2,38*18,.*5,34*5,.*14",".*49,3l*7,1e*5,21*2,a*3,24*4,1l,l*4,1z*2,2f,e*2,c*2,r*2,v,r,v,2p*8,m*4,7*3,13*3,k*2,p*4,1h,38*3,33*4,38*10,.*7,34*4,.*15",".*49,3l*8,1e*3,3l*2,21*3,24*5,1l,1q*2,l*3,1z*2,e*2,c,r*6,2p*8,m*2,7*4,13*2,k,13,k*2,p*4,38*3,33*6,38*8,.*7,34*5,.*15",".*49,3l*13,21*3,24*5,1q,1l,1q,1a*3,20*2,e,1i*3,r*5,2p*7,m*3,7*4,13*3,k*3,p*3,33*11,38*4,33,38,.*7,34*4,.*17",".*49,3l*14,21*2,24*3,1q*6,1a,20*3,1i*5,1s,r*3,2p*7,m*2,g*3,13*5,k*4,p,35,33*12,38,33,38*2,33,.*7,34*4,.*17",".*49,3l*15,1,24,1,24,1*3,1q*4,18,20*2,1i*4,1s*2,r*3,2p*7,m*2,g*3,13*5,k*4,35*2,33*16,.*8,34*3,.*18",".*49,3l*10,3i*2,3l*4,1*6,1q*2,18*4,4,1s*3,1i,1s*2,16*2,2a*3,2p*2,9,2p*2,m,2p,g*4,13*4,k*3,35*4,33*15,.*8,34*2,.*19",".*49,3l*9,3i*6,1*7,1q*3,18*2,4*2,1s*4,16*4,2a*4,2p,9*2,2p*3,g*4,13*3,35*8,33*14,.*30",".*49,3l*2,3j*5,3l,3j*3,3i*5,1*7,18*4,4*2,1s*4,16*3,y,2a*4,9*4,2p,g*4,35*12,33*13,.*31",".*49,3j*11,3i,3j*2,3i*2,3e,1*3,18,1,18*6,1s*4,16*3,y*2,2a*2,9*7,g*2,35*22,33*5,.*31",".*49,3j*13,3i*3,3e,1,3e,18*8,1s*6,16,1o,y*2,9*8,g*4,32*2,35*19,33*4,.*32",".*49,3g*3,3j*12,3i,3e*4,18*8,1s*5,1o*4,9*8,32*6,35*22,33,.*32",".*49,3g*6,3j*10,3e*4,18*7,1s*7,1o*3,9*7,32*7,35*22,33,.*32",".*49,3g*8,3j*7,3e*6,18*7,1s*5,1o*4,9*7,32*5,35*24,33,.*32",".*50,3g*9,3j*4,3e*8,18,1s*11,1o*3,9*5,32*10,35*21,33,.*32",".*50,3g*11,3j*2,3e*8,18,1s*11,1o*4,9*4,32*9,35*22,33,.*32",".*50,3c*4,3g*7,3j*3,3e*7,1s*12,1o*5,9*2,32*9,35*23,33*2,.*31",".*49,3c*6,3g*5,3e*11,1s*12,1o*3,9,1o,9*2,32*8,35*24,33,.*32",".*48,3c*7,3g*5,3e*12,1s*10,1o*4,9*2,32*10,35*24,33,.*32",".*46,3c*10,3g,3c,3g*2,3e*12,1s*10,1o*4,32,9,32*10,35*24,.*33",".*45,3c*15,3e*14,1s*9,1o*2,32*12,35*23,.*35",".*45,3c*15,3e*14,1s*10,1o,32*12,35*23,.*35",".*44,3d*2,3c*13,3e*16,1s*8,32,1o,32*11,35*23,.*36",".*44,3d*3,3c*15,3e*13,1s*7,32*14,35*20,.*2,35,.*36",".*44,3d*4,3b,3c*12,3e*16,1s*3,32*14,35*22,.*7,35,.*31",".*44,3d*3,3b*2,3c,3b,3c*10,3e*17,1s,32*16,35*22,.*5,35*2,.*31",".*44,3d*2,3b*4,3c,3b,3c*10,3e*17,32*16,35*23,.,35*5,.*31",".*44,3d*2,3b*6,3c*10,3e*18,32*15,35*29,.*31",".*44,3b*7,3c,3b,3c*9,3e*19,32*14,35*29,.*31",".*44,3b*10,3c*8,3e*20,32*11,35*29,.*33",".*43,3b*11,3c*11,3e*17,32*12,35*25,.*36",".*43,3b*11,3c*4,3b*5,3c*2,3e*17,32*12,35*25,.*36",".*43,3b*11,3c*4,3b*5,3c,3e*18,32*13,35*24,.*3,35*2,.*31",".*42,3b*12,3c*4,3b*5,3e*19,32*12,35*24,.*2,35*3,.*32",".*40,3b*16,3c,3b*6,3e*19,32*10,2z,32,35*24,.*2,35*2,.*33",".*39,3b*24,3e*19,2z*14,35,2z*4,35*17,.,35*2,.*34",".*38,3b*25,3e*9,3k*2,3e*8,2z*18,35*21,.*34",".*37,3b*26,3e*8,3k*3,3e*8,2z*18,35*5,2z*16,.*34",".*35,3b*28,3e*8,3k*3,3e*8,2z*20,35*2,2z*17,.*34",".*34,3b*23,3k*2,3b*2,3k,3b,3e*4,3k*7,3e*8,2z*38,.*35",".*32,3b,3a*2,3b*22,3k*17,3e*8,2z*38,.*35",".*31,3a*5,3b*21,3h*3,3k*14,3e*8,2z*26,2y*12,.*35",".*28,3a*9,3b,3a,3b*17,3h*4,3k*20,3e*2,2z*25,2y*12,.*36",".*27,3a*12,3b*15,3h*6,3k*20,3e*2,2z,2y,2z*22,2y*13,.*36",".*26,3a*13,3b,3h*2,3b*12,3h*6,3k*22,2y*3,2z*19,2y*15,.*36",".*25,3a*16,3h*2,3b*11,3h*6,3k*22,2y*4,2z*2,2y*2,2z*13,2y*15,.*37",".*23,3a*18,3h*2,3b*7,3h*10,3k*22,2y*8,2z*13,2y*15,.*37",".*21,3a*21,3h*2,3b*6,3h*10,3k*22,2y*10,2z*10,2y*16,.*37",".*10,3a*3,.*6,3a*22,3h*6,3b*3,3h*7,3k*25,2y*10,2z*9,2y*16,.*38",".,3a*13,.*2,3a*21,3h*12,3b,3h*7,3k*25,2y*10,2z*8,2y*17,.*11,2y,.*26",".,3a*14,.,3a*21,3h*11,3b*2,3h*6,3k*26,2y*35,.*38",".*2,3a*35,3h*11,3b*2,3h*6,3k*26,2y*35,.*9,2y,.*28",".*2,3a*5,3f*3,3a*4,3f,3a*22,3h*20,3k*25,2y*34,.*39",".*2,3a*5,3f*9,3a*21,3h*12,39*2,3h*6,3k*25,2y*34,.*10,2y,.*28",".*3,3a,.,3a*3,3f*9,3a*19,3h*8,39*6,3h*9,3k*23,2y*15,.*7,2y*12,.*39",".*8,3f*8,3a*20,3h*8,39*7,3h*8,3k*24,2y*14,.*7,2y*12,.*39",".*8,3f*8,3a*21,3h*7,39*7,3h*8,3k*23,2y*15,.*12,2y*6,.*10,2y,.*29",".*8,3f*8,3a*18,39,3a,39,3h*7,39*7,3h*8,3k*23,2y*15,.*12,2y*6,.*40",".*8,3f*6,3a,3f,3a*18,39*4,3h*4,39*9,3h*8,3k*23,2y*14,.*13,2y*5,.*41",".*8,3f*8,3a*16,39*9,3h,39*9,3h*8,3k*23,2y*13,.*14,2y*5,.*41",".*8,3f*9,3a*15,39*19,3h*8,3k*23,2y*13,.*14,2y*5,.*41",".*8,3f*9,3a*14,39*23,3h,3k*27,2y*11,.*16,2y*5,.*41",".*8,3f*11,3a*3,.,3a*8,39*24,3k*27,2y*11,.*19,2y,.*42",".*9,3f*10,3a*3,.*3,3a*6,39*24,3k*26,2y*12,.*62",".*12,3f*7,3a*3,.*5,3a*2,39*26,3k*27,2y*11,.*62",".*13,3f*5,3a*4,.*7,39*26,3k*27,2y*10,.*63",".*15,3f*3,3a*4,.*9,39*24,3k*26,2y*3,.,2y*6,.*64",".*17,3f*2,3a*2,.*16,39*18,3k*26,2y,.*4,2y*4,.*65",".*19,3a*3,.*15,39*18,3k*27,.*6,2y,.*66",".*37,39*18,3k*27,.*73",".*37,39*18,3k*27,.*73",".*155",".*155"],"palette":[["#E98B1E","#D9312E","#F6CD1F","#F5A23A","#B5212E","#E8654A"],["#2E9BD6","#7CC8EC","#1F6FAE"],["#5DAA3B","#9ACB6E"]]}
